{
  "schemaDialect": "http://json-schema.org/draft-07/schema#",
  "schemaPath": "docs/policies/active-policy-set.v11.schema.json",
  "manifestType": "ai7-active-policy-set",
  "version": "v11",
  "predecessorVersion": "v10",
  "predecessorCanonicalPath": "docs/policies/active-policy-set.v10.json",
  "digestAlgorithm": "sha256",
  "trustedOperationalScopeSelection": {
    "exactlyOneProviderProcessingScopeBoundPerLaunch": true,
    "selectionAuthorityClass": "trusted-build-or-launch-authority",
    "ordinaryProductSettingAllowed": false,
    "environmentVariableSelectorAllowed": false,
    "providerSelectorAllowed": false,
    "artifactOrPluginSelectorAllowed": false,
    "crossScopeFallbackAllowed": false,
    "missingOrUnknownScopeResult": "deny-provider-processing"
  },
  "activePolicies": {
    "provider-processing-policy": {
      "selectionType": "trusted-operational-scope-map",
      "scopePins": {
        "development-ci": {
          "policyId": "provider-processing-policy",
          "policyType": "provider-processing",
          "version": "v1",
          "canonicalPath": "docs/policies/provider-processing-policy.v1.json",
          "sha256": "d9dfe8c13a58649d8d9f607364030468ae71832b94c9436291d29000795d725a"
        },
        "fixture-recording": {
          "policyId": "provider-processing-policy",
          "policyType": "provider-processing",
          "version": "v2",
          "canonicalPath": "docs/policies/provider-processing-policy.v2.json",
          "sha256": "d0e3996ce7ba091200d83178b48fb578090bf73b509406182a2d5403ab2a4ebc"
        },
        "ordinary-production": {
          "policyId": "provider-processing-policy",
          "policyType": "provider-processing",
          "version": "v15",
          "canonicalPath": "docs/policies/provider-processing-policy.v15.json",
          "sha256": "1f398f923d57a442fe6c410b5831c25f45c6983973ccfcf619472db8a8666b46"
        },
        "developer-live": {
          "policyId": "provider-processing-policy",
          "policyType": "provider-processing",
          "version": "v14",
          "canonicalPath": "docs/policies/provider-processing-policy.v14.json",
          "sha256": "98ec1f93f26e896d1a6a37b3829eacffb7deb9b52f8966252aa3f7115717bb6d"
        }
      }
    },
    "external-export-policy": {
      "policyId": "external-export-policy",
      "policyType": "external-export",
      "version": "v2",
      "canonicalPath": "docs/policies/external-export-policy.v2.json",
      "sha256": "162441cc3e5d30b0cafb00a0d04ca5ab32b64c5039baafc8952a9925bd7984b6"
    }
  }
}
